{
  "type": "form_binding_spec",
  "form_id": "googleforms::1FAIpQLSe_example",
  "binding_id": "example_intake",
  "version": "1.0.0",
  "description": "Example intake form with PHQ-9 and GAD-7",
  "sections": [
    {
      "name": "PHQ-9 Section",
      "measure_id": "phq9",
      "measure_version": "1.0.0",
      "bindings": [
        { "item_id": "phq9_item1", "by": "field_key", "value": "entry.123456001" },
        { "item_id": "phq9_item2", "by": "field_key", "value": "entry.123456002" },
        { "item_id": "phq9_item3", "by": "field_key", "value": "entry.123456003" },
        { "item_id": "phq9_item4", "by": "field_key", "value": "entry.123456004" },
        { "item_id": "phq9_item5", "by": "field_key", "value": "entry.123456005" },
        { "item_id": "phq9_item6", "by": "field_key", "value": "entry.123456006" },
        { "item_id": "phq9_item7", "by": "field_key", "value": "entry.123456007" },
        { "item_id": "phq9_item8", "by": "field_key", "value": "entry.123456008" },
        { "item_id": "phq9_item9", "by": "field_key", "value": "entry.123456009" },
        { "item_id": "phq9_item10", "by": "field_key", "value": "entry.123456010" }
      ]
    },
    {
      "name": "GAD-7 Section",
      "measure_id": "gad7",
      "measure_version": "1.0.0",
      "bindings": [
        { "item_id": "gad7_item1", "by": "field_key", "value": "entry.789012001" },
        { "item_id": "gad7_item2", "by": "field_key", "value": "entry.789012002" },
        { "item_id": "gad7_item3", "by": "field_key", "value": "entry.789012003" },
        { "item_id": "gad7_item4", "by": "field_key", "value": "entry.789012004" },
        { "item_id": "gad7_item5", "by": "field_key", "value": "entry.789012005" },
        { "item_id": "gad7_item6", "by": "field_key", "value": "entry.789012006" },
        { "item_id": "gad7_item7", "by": "field_key", "value": "entry.789012007" },
        { "item_id": "gad7_item8", "by": "field_key", "value": "entry.789012008" }
      ]
    }
  ]
}
